{
  "page_id": 1,
  "metadata": {
    "file_name": "doc_0850.png",
    "image_width": 771,
    "image_height": 1000
  },
  "lines": [
    {
      "text": "CONFIDENTIAL:",
      "bbox": [
        475,
        2,
        626,
        22
      ],
      "confidence": 0.9999158382415771
    },
    {
      "text": "MINNESOTA TOBACCO LITIGATION",
      "bbox": [
        380,
        21,
        716,
        42
      ],
      "confidence": 0.9994744062423706
    },
    {
      "text": "BUDGET",
      "bbox": [
        386,
        42,
        456,
        62
      ],
      "confidence": 0.9998419284820557
    },
    {
      "text": "PUBLIC SERVICE",
      "bbox": [
        271,
        74,
        424,
        92
      ],
      "confidence": 0.9965653419494629
    },
    {
      "text": "ADVERTISEMENTS",
      "bbox": [
        416,
        77,
        565,
        95
      ],
      "confidence": 0.9996547102928162
    },
    {
      "text": "YOUTH INITIATIVES",
      "bbox": [
        330,
        106,
        508,
        124
      ],
      "confidence": 0.9989421963691711
    },
    {
      "text": "Development Costs (from existing budget)",
      "bbox": [
        120,
        183,
        520,
        209
      ],
      "confidence": 0.9990733861923218
    },
    {
      "text": "1)",
      "bbox": [
        88,
        218,
        117,
        244
      ],
      "confidence": 0.9593448638916016
    },
    {
      "text": "Focus group testing to",
      "bbox": [
        139,
        218,
        359,
        239
      ],
      "confidence": 0.9797031879425049
    },
    {
      "text": "develop basic themes",
      "bbox": [
        139,
        234,
        338,
        255
      ],
      "confidence": 0.9887339472770691
    },
    {
      "text": "$44,000",
      "bbox": [
        486,
        233,
        560,
        254
      ],
      "confidence": 0.9998127222061157
    },
    {
      "text": "2)",
      "bbox": [
        89,
        267,
        113,
        290
      ],
      "confidence": 0.9536060690879822
    },
    {
      "text": "Script development &",
      "bbox": [
        137,
        266,
        338,
        286
      ],
      "confidence": 0.9923311471939087
    },
    {
      "text": "storyboards (@ $250/script)",
      "bbox": [
        136,
        280,
        405,
        304
      ],
      "confidence": 0.9525734186172485
    },
    {
      "text": "2,500",
      "bbox": [
        503,
        281,
        559,
        302
      ],
      "confidence": 0.9995965957641602
    },
    {
      "text": "3)",
      "bbox": [
        87,
        313,
        113,
        338
      ],
      "confidence": 0.8439733982086182
    },
    {
      "text": "Focus group testing of",
      "bbox": [
        134,
        312,
        356,
        335
      ],
      "confidence": 0.9723596572875977
    },
    {
      "text": "storyboaris",
      "bbox": [
        136,
        331,
        247,
        350
      ],
      "confidence": 0.9958601593971252
    },
    {
      "text": "40,000",
      "bbox": [
        491,
        327,
        559,
        351
      ],
      "confidence": 0.9988164901733398
    },
    {
      "text": "Total",
      "bbox": [
        115,
        362,
        170,
        383
      ],
      "confidence": 0.9998816251754761
    },
    {
      "text": "$86,500",
      "bbox": [
        484,
        362,
        559,
        383
      ],
      "confidence": 0.9997910261154175
    },
    {
      "text": "Estimated :roduction Costs (would require new budget authority)",
      "bbox": [
        122,
        410,
        734,
        435
      ],
      "confidence": 0.9820879697799683
    },
    {
      "text": "1)",
      "bbox": [
        81,
        444,
        106,
        468
      ],
      "confidence": 0.9628416299819946
    },
    {
      "text": "Production of 6 - 8 television",
      "bbox": [
        128,
        445,
        438,
        467
      ],
      "confidence": 0.9811612367630005
    },
    {
      "text": "ads ($30,()00/ad)",
      "bbox": [
        129,
        462,
        289,
        483
      ],
      "confidence": 0.9331581592559814
    },
    {
      "text": "$180,000 - $240,000",
      "bbox": [
        465,
        463,
        662,
        485
      ],
      "confidence": 0.9691553711891174
    },
    {
      "text": "2)",
      "bbox": [
        76,
        491,
        105,
        519
      ],
      "confidence": 0.9220678806304932
    },
    {
      "text": "Distribut .on and duplication",
      "bbox": [
        126,
        494,
        417,
        516
      ],
      "confidence": 0.9794359803199768
    },
    {
      "text": "through P:iA Network",
      "bbox": [
        127,
        512,
        325,
        531
      ],
      "confidence": 0.9663928747177124
    },
    {
      "text": "50,000",
      "bbox": [
        482,
        509,
        554,
        537
      ],
      "confidence": 0.9983651638031006
    },
    {
      "text": "Total",
      "bbox": [
        105,
        543,
        162,
        565
      ],
      "confidence": 0.9999071955680847
    },
    {
      "text": "$230,000 - $290,000",
      "bbox": [
        466,
        546,
        664,
        567
      ],
      "confidence": 0.9728739857673645
    },
    {
      "text": "TIMN 0058298",
      "bbox": [
        551,
        917,
        729,
        950
      ],
      "confidence": 0.9597814679145813
    }
  ],
  "full_text": "CONFIDENTIAL:\nMINNESOTA TOBACCO LITIGATION\nBUDGET\nPUBLIC SERVICE\nADVERTISEMENTS\nYOUTH INITIATIVES\nDevelopment Costs (from existing budget)\n1)\nFocus group testing to\ndevelop basic themes\n$44,000\n2)\nScript development &\nstoryboards (@ $250/script)\n2,500\n3)\nFocus group testing of\nstoryboaris\n40,000\nTotal\n$86,500\nEstimated :roduction Costs (would require new budget authority)\n1)\nProduction of 6 - 8 television\nads ($30,()00/ad)\n$180,000 - $240,000\n2)\nDistribut .on and duplication\nthrough P:iA Network\n50,000\nTotal\n$230,000 - $290,000\nTIMN 0058298"
}