{
  "page_id": 1,
  "metadata": {
    "file_name": "doc_0354.png",
    "image_width": 762,
    "image_height": 1000
  },
  "lines": [
    {
      "text": "KOOLGOLD",
      "bbox": [
        307,
        421,
        435,
        457
      ],
      "confidence": 0.9909273386001587
    },
    {
      "text": "NON-MENTHoI",
      "bbox": [
        327,
        543,
        413,
        561
      ],
      "confidence": 0.7345513701438904
    },
    {
      "text": "Introducing KOOL GOLD. Enjoy refreshing",
      "bbox": [
        135,
        661,
        612,
        694
      ],
      "confidence": 0.9922483563423157
    },
    {
      "text": "flavorful satisfaction. .. without menthcl.",
      "bbox": [
        136,
        685,
        575,
        716
      ],
      "confidence": 0.9741790890693665
    },
    {
      "text": "Many smokers find low 'tar'",
      "bbox": [
        146,
        738,
        326,
        761
      ],
      "confidence": 0.9855263233184814
    },
    {
      "text": "patenled filter which channels the",
      "bbox": [
        385,
        734,
        602,
        755
      ],
      "confidence": 0.9900000095367432
    },
    {
      "text": "cigarettes taste like hot air, pretty dry.",
      "bbox": [
        125,
        751,
        363,
        773
      ],
      "confidence": 0.9886012077331543
    },
    {
      "text": "smoke to cool it as it traps 'tar\", and",
      "bbox": [
        384,
        748,
        606,
        766
      ],
      "confidence": 0.9409608244895935
    },
    {
      "text": "Yet, for some, menthol is not the",
      "bbox": [
        126,
        763,
        338,
        785
      ],
      "confidence": 0.9743808507919312
    },
    {
      "text": "harsh tasting elements.",
      "bbox": [
        384,
        762,
        532,
        778
      ],
      "confidence": 0.990225076675415
    },
    {
      "text": "answer.",
      "bbox": [
        128,
        782,
        181,
        796
      ],
      "confidence": 0.995016872882843
    },
    {
      "text": "from KOOL GOLD is flavo:ful and",
      "bbox": [
        383,
        786,
        599,
        807
      ],
      "confidence": 0.9630701541900635
    },
    {
      "text": "So the taste that comes through",
      "bbox": [
        404,
        774,
        612,
        793
      ],
      "confidence": 0.9902288913726807
    },
    {
      "text": "Now there's KOOL GOLD. A new",
      "bbox": [
        148,
        790,
        358,
        813
      ],
      "confidence": 0.9828076958656311
    },
    {
      "text": "refreshing . . . without menthot, and",
      "bbox": [
        383,
        798,
        605,
        820
      ],
      "confidence": 0.9400763511657715
    },
    {
      "text": "kind of low 'tar' cigarette. KOOL has",
      "bbox": [
        129,
        804,
        358,
        824
      ],
      "confidence": 0.9696757197380066
    },
    {
      "text": "found a way to give you a truly",
      "bbox": [
        129,
        816,
        332,
        838
      ],
      "confidence": 0.9773656129837036
    },
    {
      "text": "with only 8 mg. 'tar.",
      "bbox": [
        384,
        810,
        518,
        832
      ],
      "confidence": 0.9607257843017578
    },
    {
      "text": "C",
      "bbox": [
        92,
        820,
        121,
        849
      ],
      "confidence": 0.8500221967697144
    },
    {
      "text": "satisfying, refreshing smoke without",
      "bbox": [
        130,
        829,
        358,
        849
      ],
      "confidence": 0.9880316853523254
    },
    {
      "text": "menthol. This cigarelte has a",
      "bbox": [
        132,
        842,
        320,
        861
      ],
      "confidence": 0.9855865836143494
    },
    {
      "text": "8 mg. \"tar' .8 mg. nicotine",
      "bbox": [
        454,
        835,
        616,
        854
      ],
      "confidence": 0.9455830454826355
    },
    {
      "text": ")",
      "bbox": [
        620,
        855,
        632,
        869
      ],
      "confidence": 0.9783113598823547
    },
    {
      "text": "DHE FILM IMACE IS LESS CLEAR",
      "bbox": [
        62,
        931,
        225,
        950
      ],
      "confidence": 0.8826733231544495
    },
    {
      "text": "68703",
      "bbox": [
        230,
        928,
        349,
        965
      ],
      "confidence": 0.9995023012161255
    },
    {
      "text": "QCALITY, O THE'DOCUMENT BETNG FILMELD.",
      "bbox": [
        18,
        950,
        219,
        970
      ],
      "confidence": 0.7710412740707397
    },
    {
      "text": "THLS MOTICE, ITT IS DUE TO THE",
      "bbox": [
        48,
        941,
        205,
        959
      ],
      "confidence": 0.8388964533805847
    },
    {
      "text": "5",
      "bbox": [
        414,
        938,
        431,
        950
      ],
      "confidence": 0.9997218251228333
    }
  ],
  "full_text": "KOOLGOLD\nNON-MENTHoI\nIntroducing KOOL GOLD. Enjoy refreshing\nflavorful satisfaction. .. without menthcl.\nMany smokers find low 'tar'\npatenled filter which channels the\ncigarettes taste like hot air, pretty dry.\nsmoke to cool it as it traps 'tar\", and\nYet, for some, menthol is not the\nharsh tasting elements.\nanswer.\nfrom KOOL GOLD is flavo:ful and\nSo the taste that comes through\nNow there's KOOL GOLD. A new\nrefreshing . . . without menthot, and\nkind of low 'tar' cigarette. KOOL has\nfound a way to give you a truly\nwith only 8 mg. 'tar.\nC\nsatisfying, refreshing smoke without\nmenthol. This cigarelte has a\n8 mg. \"tar' .8 mg. nicotine\n)\nDHE FILM IMACE IS LESS CLEAR\n68703\nQCALITY, O THE'DOCUMENT BETNG FILMELD.\nTHLS MOTICE, ITT IS DUE TO THE\n5"
}