{
  "page_id": 1,
  "metadata": {
    "file_name": "doc_0945.png",
    "image_width": 723,
    "image_height": 1000
  },
  "lines": [
    {
      "text": "DEMANDE D'ANALYSE GC-MS",
      "bbox": [
        205,
        110,
        412,
        136
      ],
      "confidence": 0.9810383915901184
    },
    {
      "text": "No 001-93",
      "bbox": [
        542,
        99,
        658,
        139
      ],
      "confidence": 0.959604024887085
    },
    {
      "text": "Références : Jau",
      "bbox": [
        19,
        185,
        187,
        209
      ],
      "confidence": 0.9327700734138489
    },
    {
      "text": "Projet :Cullura",
      "bbox": [
        258,
        185,
        395,
        203
      ],
      "confidence": 0.9363150000572205
    },
    {
      "text": "Date :18-93",
      "bbox": [
        474,
        174,
        599,
        207
      ],
      "confidence": 0.8763132095336914
    },
    {
      "text": "Motif de la demande",
      "bbox": [
        17,
        244,
        197,
        264
      ],
      "confidence": 0.9978787302970886
    },
    {
      "text": ": Amalyses t uepiaculon in 3 e samfhes",
      "bbox": [
        246,
        237,
        630,
        262
      ],
      "confidence": 0.8054366707801819
    },
    {
      "text": "2252",
      "bbox": [
        271,
        288,
        331,
        316
      ],
      "confidence": 0.7360529899597168
    },
    {
      "text": "+258",
      "bbox": [
        367,
        285,
        416,
        311
      ],
      "confidence": 0.9002580046653748
    },
    {
      "text": "7256",
      "bbox": [
        454,
        283,
        505,
        306
      ],
      "confidence": 0.8860407471656799
    },
    {
      "text": ": Saple",
      "bbox": [
        553,
        280,
        630,
        308
      ],
      "confidence": 0.8750180006027222
    },
    {
      "text": "0.050.051-",
      "bbox": [
        371,
        305,
        534,
        340
      ],
      "confidence": 0.8348289728164673
    },
    {
      "text": "Identification de l'éch. :",
      "bbox": [
        14,
        315,
        257,
        338
      ],
      "confidence": 0.989936888217926
    },
    {
      "text": "0.0+",
      "bbox": [
        276,
        316,
        349,
        338
      ],
      "confidence": 0.8448907136917114
    },
    {
      "text": "Abs, Concentratio,",
      "bbox": [
        573,
        310,
        698,
        331
      ],
      "confidence": 0.8821930885314941
    },
    {
      "text": "Préparation de l'éch.",
      "bbox": [
        12,
        362,
        209,
        381
      ],
      "confidence": 0.9640950560569763
    },
    {
      "text": ":",
      "bbox": [
        243,
        368,
        252,
        379
      ],
      "confidence": 0.9785541892051697
    },
    {
      "text": "solvant",
      "bbox": [
        9,
        407,
        83,
        425
      ],
      "confidence": 0.9999579191207886
    },
    {
      "text": ": n-hexame",
      "bbox": [
        240,
        409,
        365,
        426
      ],
      "confidence": 0.8543617129325867
    },
    {
      "text": "Conditions GC",
      "bbox": [
        11,
        483,
        144,
        500
      ],
      "confidence": 0.9853461384773254
    },
    {
      "text": " int :",
      "bbox": [
        517,
        530,
        594,
        557
      ],
      "confidence": 0.9294633865356445
    },
    {
      "text": "Colonne",
      "bbox": [
        5,
        536,
        87,
        560
      ],
      "confidence": 0.9998708367347717
    },
    {
      "text": ":DB-5",
      "bbox": [
        192,
        534,
        266,
        559
      ],
      "confidence": 0.9478481411933899
    },
    {
      "text": "long : 33m",
      "bbox": [
        339,
        536,
        453,
        557
      ],
      "confidence": 0.97157222032547
    },
    {
      "text": "Mode d'injection : gl'tless",
      "bbox": [
        2,
        577,
        307,
        605
      ],
      "confidence": 0.9075661301612854
    },
    {
      "text": "Volume d'injection :2",
      "bbox": [
        0,
        625,
        284,
        649
      ],
      "confidence": 0.9578543305397034
    },
    {
      "text": "2501232042",
      "bbox": [
        623,
        658,
        654,
        773
      ],
      "confidence": 0.99993896484375
    },
    {
      "text": "Détecteur",
      "bbox": [
        3,
        671,
        102,
        694
      ],
      "confidence": 0.9826988577842712
    },
    {
      "text": ": ECD",
      "bbox": [
        191,
        670,
        266,
        692
      ],
      "confidence": 0.983180820941925
    },
    {
      "text": "Programme de temp. : 60\"c 2min",
      "bbox": [
        3,
        709,
        369,
        740
      ],
      "confidence": 0.8876084089279175
    },
    {
      "text": "zoc\\min to 150.",
      "bbox": [
        216,
        734,
        409,
        764
      ],
      "confidence": 0.7439077496528625
    },
    {
      "text": "3oc\\min 10 2A0c",
      "bbox": [
        216,
        761,
        405,
        783
      ],
      "confidence": 0.6730937361717224
    },
    {
      "text": "15minat2tc",
      "bbox": [
        230,
        780,
        442,
        809
      ],
      "confidence": 0.6828253865242004
    },
    {
      "text": "Joindre avec l'échantillon, une copie du chromatogramme et indiquer",
      "bbox": [
        1,
        810,
        640,
        843
      ],
      "confidence": 0.9854701161384583
    },
    {
      "text": "le(s) pic(s) a identifier.",
      "bbox": [
        4,
        847,
        258,
        872
      ],
      "confidence": 0.9599055647850037
    },
    {
      "text": "Dsam{les",
      "bbox": [
        0,
        886,
        120,
        916
      ],
      "confidence": 0.6889764070510864
    }
  ],
  "full_text": "DEMANDE D'ANALYSE GC-MS\nNo 001-93\nRéférences : Jau\nProjet :Cullura\nDate :18-93\nMotif de la demande\n: Amalyses t uepiaculon in 3 e samfhes\n2252\n+258\n7256\n: Saple\n0.050.051-\nIdentification de l'éch. :\n0.0+\nAbs, Concentratio,\nPréparation de l'éch.\n:\nsolvant\n: n-hexame\nConditions GC\n int :\nColonne\n:DB-5\nlong : 33m\nMode d'injection : gl'tless\nVolume d'injection :2\n2501232042\nDétecteur\n: ECD\nProgramme de temp. : 60\"c 2min\nzoc\\min to 150.\n3oc\\min 10 2A0c\n15minat2tc\nJoindre avec l'échantillon, une copie du chromatogramme et indiquer\nle(s) pic(s) a identifier.\nDsam{les"
}