{
  "page_id": 1,
  "metadata": {
    "file_name": "doc_0090.png",
    "image_width": 754,
    "image_height": 1000
  },
  "lines": [
    {
      "text": "Private & Confidential",
      "bbox": [
        65,
        41,
        237,
        65
      ],
      "confidence": 0.9947956204414368
    },
    {
      "text": "R.J.Reynolds Tcbacco Company",
      "bbox": [
        448,
        62,
        649,
        91
      ],
      "confidence": 0.9704336524009705
    },
    {
      "text": "Winston-Salem, NC 27102",
      "bbox": [
        450,
        81,
        602,
        103
      ],
      "confidence": 0.9479398131370544
    },
    {
      "text": "·s G Coty",
      "bbox": [
        65,
        124,
        119,
        143
      ],
      "confidence": 0.7124778032302856
    },
    {
      "text": "AssocateEaneufeweeisurs",
      "bbox": [
        74,
        137,
        222,
        153
      ],
      "confidence": 0.6247938871383667
    },
    {
      "text": "RJR",
      "bbox": [
        446,
        133,
        512,
        172
      ],
      "confidence": 0.8801928162574768
    },
    {
      "text": "ResearchDepartn",
      "bbox": [
        75,
        148,
        161,
        161
      ],
      "confidence": 0.7826985120773315
    },
    {
      "text": "January 10, 1980",
      "bbox": [
        453,
        185,
        575,
        209
      ],
      "confidence": 0.9986693859100342
    },
    {
      "text": "Mr. Wilfried Dembach",
      "bbox": [
        73,
        241,
        226,
        261
      ],
      "confidence": 0.9858657717704773
    },
    {
      "text": "RE: Verband Research on",
      "bbox": [
        451,
        246,
        624,
        270
      ],
      "confidence": 0.9935358166694641
    },
    {
      "text": "R.J.REYNOLDS TOBACOO GMBH",
      "bbox": [
        74,
        257,
        263,
        276
      ],
      "confidence": 0.9787278771400452
    },
    {
      "text": "Smoking Motivation",
      "bbox": [
        482,
        262,
        617,
        286
      ],
      "confidence": 0.9864795207977295
    },
    {
      "text": "Geschlftsleitung",
      "bbox": [
        73,
        272,
        197,
        294
      ],
      "confidence": 0.9648415446281433
    },
    {
      "text": "by Bergler",
      "bbox": [
        480,
        277,
        561,
        301
      ],
      "confidence": 0.9980939030647278
    },
    {
      "text": "Postfach 100558",
      "bbox": [
        74,
        288,
        189,
        308
      ],
      "confidence": 0.9984953999519348
    },
    {
      "text": "5000 Cologne 1",
      "bbox": [
        74,
        304,
        183,
        325
      ],
      "confidence": 0.9991111159324646
    },
    {
      "text": "Germany",
      "bbox": [
        73,
        320,
        133,
        341
      ],
      "confidence": 0.9853224754333496
    },
    {
      "text": "Dear Wilfried:",
      "bbox": [
        75,
        384,
        181,
        402
      ],
      "confidence": 0.9709381461143494
    },
    {
      "text": "After returning from vacation I found the RJR internal memorancum",
      "bbox": [
        134,
        413,
        609,
        434
      ],
      "confidence": 0.9808549880981445
    },
    {
      "text": "by Mr. Thies of Decerber 12, 1979, on the presentaiion by Prof. Bergler",
      "bbox": [
        77,
        430,
        595,
        451
      ],
      "confidence": 0.9810938239097595
    },
    {
      "text": "on smoking motivation, given in Hamburg.",
      "bbox": [
        77,
        447,
        368,
        466
      ],
      "confidence": 0.9865926504135132
    },
    {
      "text": "While I am, of course, aware of the monograph by Bergler on cigarette",
      "bbox": [
        135,
        478,
        635,
        495
      ],
      "confidence": 0.9919183850288391
    },
    {
      "text": "advertising and cigarette consunption, I was, until now, not aware that the",
      "bbox": [
        77,
        493,
        621,
        511
      ],
      "confidence": 0.9852238893508911
    },
    {
      "text": "Verband has commissioned any, obviously costly, research on that topic. We",
      "bbox": [
        78,
        511,
        615,
        525
      ],
      "confidence": 0.9898129105567932
    },
    {
      "text": "have checked our files and have not found any prior mentioning of such Verband",
      "bbox": [
        77,
        525,
        643,
        542
      ],
      "confidence": 0.9862158298492432
    },
    {
      "text": "research, and I also have similarly \"checked my memory' and have drawn a",
      "bbox": [
        76,
        537,
        603,
        560
      ],
      "confidence": 0.9880968928337097
    },
    {
      "text": "similar blank.",
      "bbox": [
        76,
        554,
        181,
        574
      ],
      "confidence": 0.9982137084007263
    },
    {
      "text": "This is obviously a sensitive topic and, in my judgment, it falls under",
      "bbox": [
        135,
        584,
        651,
        604
      ],
      "confidence": 0.9697121381759644
    },
    {
      "text": "the subjects where there should be some input from Winston-Salem, before any",
      "bbox": [
        78,
        600,
        629,
        619
      ],
      "confidence": 0.988222599029541
    },
    {
      "text": "commitments by RJR are made.",
      "bbox": [
        79,
        619,
        281,
        633
      ],
      "confidence": 0.9526575803756714
    },
    {
      "text": "sincerely,",
      "bbox": [
        453,
        640,
        529,
        665
      ],
      "confidence": 0.9254179000854492
    },
    {
      "text": "FGC/ks",
      "bbox": [
        74,
        708,
        127,
        729
      ],
      "confidence": 0.9537456631660461
    },
    {
      "text": "Pank G. Colly",
      "bbox": [
        452,
        698,
        562,
        734
      ],
      "confidence": 0.8575242757797241
    },
    {
      "text": "CC: B.F.P.",
      "bbox": [
        74,
        737,
        151,
        757
      ],
      "confidence": 0.9054203033447266
    },
    {
      "text": "S.B.W.",
      "bbox": [
        104,
        753,
        152,
        771
      ],
      "confidence": 0.9698006510734558
    },
    {
      "text": "E.J.J.",
      "bbox": [
        104,
        769,
        152,
        787
      ],
      "confidence": 0.9996638298034668
    },
    {
      "text": "dalked to SBw abtit",
      "bbox": [
        224,
        803,
        404,
        834
      ],
      "confidence": 0.9007811546325684
    },
    {
      "text": "50088 2350",
      "bbox": [
        674,
        830,
        695,
        923
      ],
      "confidence": 0.9869743585586548
    }
  ],
  "full_text": "Private & Confidential\nR.J.Reynolds Tcbacco Company\nWinston-Salem, NC 27102\n·s G Coty\nAssocateEaneufeweeisurs\nRJR\nResearchDepartn\nJanuary 10, 1980\nMr. Wilfried Dembach\nRE: Verband Research on\nR.J.REYNOLDS TOBACOO GMBH\nSmoking Motivation\nGeschlftsleitung\nby Bergler\nPostfach 100558\n5000 Cologne 1\nGermany\nDear Wilfried:\nAfter returning from vacation I found the RJR internal memorancum\nby Mr. Thies of Decerber 12, 1979, on the presentaiion by Prof. Bergler\non smoking motivation, given in Hamburg.\nWhile I am, of course, aware of the monograph by Bergler on cigarette\nadvertising and cigarette consunption, I was, until now, not aware that the\nVerband has commissioned any, obviously costly, research on that topic. We\nhave checked our files and have not found any prior mentioning of such Verband\nresearch, and I also have similarly \"checked my memory' and have drawn a\nsimilar blank.\nThis is obviously a sensitive topic and, in my judgment, it falls under\nthe subjects where there should be some input from Winston-Salem, before any\ncommitments by RJR are made.\nsincerely,\nFGC/ks\nPank G. Colly\nCC: B.F.P.\nS.B.W.\nE.J.J.\ndalked to SBw abtit\n50088 2350"
}