{
  "page_id": 1,
  "metadata": {
    "file_name": "doc_0847.png",
    "image_width": 754,
    "image_height": 1000
  },
  "lines": [
    {
      "text": "BIOGRAPHICAL SKEtcH: REsEARcH AsSIstANt",
      "bbox": [
        213,
        42,
        601,
        74
      ],
      "confidence": 0.7669716477394104
    },
    {
      "text": "Name:",
      "bbox": [
        66,
        98,
        126,
        127
      ],
      "confidence": 0.9991402626037598
    },
    {
      "text": "Theresa C. Swayne",
      "bbox": [
        249,
        101,
        403,
        124
      ],
      "confidence": 0.9864457249641418
    },
    {
      "text": "Title:",
      "bbox": [
        68,
        136,
        112,
        164
      ],
      "confidence": 0.9661290645599365
    },
    {
      "text": "Graduate Research Assistant - NSF Predoctoral Fellow",
      "bbox": [
        249,
        131,
        650,
        160
      ],
      "confidence": 0.9875074625015259
    },
    {
      "text": "28 June, 1969 - San Francisco, California",
      "bbox": [
        250,
        169,
        562,
        194
      ],
      "confidence": 0.9913716912269592
    },
    {
      "text": "Date & Place of Birth:",
      "bbox": [
        71,
        173,
        228,
        197
      ],
      "confidence": 0.9961076378822327
    },
    {
      "text": "Reed College, Portland, OR",
      "bbox": [
        250,
        202,
        452,
        227
      ],
      "confidence": 0.9759171605110168
    },
    {
      "text": "Education:",
      "bbox": [
        70,
        207,
        153,
        231
      ],
      "confidence": 0.9976513981819153
    },
    {
      "text": "B.A. in Biology, 1991",
      "bbox": [
        249,
        220,
        401,
        245
      ],
      "confidence": 0.9735608100891113
    },
    {
      "text": "Columbia University, College of Physicians & Surgeons",
      "bbox": [
        250,
        252,
        650,
        275
      ],
      "confidence": 0.9959716796875
    },
    {
      "text": "Ph.D. (in progress)",
      "bbox": [
        250,
        271,
        388,
        291
      ],
      "confidence": 0.990003764629364
    },
    {
      "text": "Professional Experience:",
      "bbox": [
        68,
        340,
        252,
        362
      ],
      "confidence": 0.9987069964408875
    },
    {
      "text": "Columbia University, College of P & S",
      "bbox": [
        68,
        355,
        345,
        379
      ],
      "confidence": 0.9771232604980469
    },
    {
      "text": "Graduate Research Assistant",
      "bbox": [
        431,
        355,
        645,
        372
      ],
      "confidence": 0.9989275932312012
    },
    {
      "text": "New York",
      "bbox": [
        68,
        372,
        224,
        395
      ],
      "confidence": 0.8754266500473022
    },
    {
      "text": "1993-present",
      "bbox": [
        430,
        372,
        531,
        392
      ],
      "confidence": 0.9998204112052917
    },
    {
      "text": "Department of Anatomy & Cell Biology",
      "bbox": [
        69,
        389,
        349,
        411
      ],
      "confidence": 0.9756672978401184
    },
    {
      "text": "Oregon Health Sciences Center",
      "bbox": [
        69,
        420,
        303,
        445
      ],
      "confidence": 0.9994794130325317
    },
    {
      "text": "Lab Assistant",
      "bbox": [
        429,
        417,
        532,
        441
      ],
      "confidence": 0.9995394349098206
    },
    {
      "text": "University of Portland, Portland, OR",
      "bbox": [
        69,
        437,
        329,
        461
      ],
      "confidence": 0.9746333360671997
    },
    {
      "text": "4/1992-8/1992",
      "bbox": [
        429,
        434,
        554,
        460
      ],
      "confidence": 0.9923365116119385
    },
    {
      "text": "Oregon National Resources Council",
      "bbox": [
        69,
        471,
        333,
        494
      ],
      "confidence": 0.9682808518409729
    },
    {
      "text": "Intern/Environmental Issues Writing",
      "bbox": [
        430,
        467,
        695,
        492
      ],
      "confidence": 0.9993743896484375
    },
    {
      "text": "6/1991 -4/1992",
      "bbox": [
        430,
        486,
        556,
        509
      ],
      "confidence": 0.9589581489562988
    },
    {
      "text": "Portiand, OR",
      "bbox": [
        70,
        493,
        167,
        510
      ],
      "confidence": 0.9744904041290283
    },
    {
      "text": "Reed College",
      "bbox": [
        70,
        524,
        172,
        544
      ],
      "confidence": 0.9998104572296143
    },
    {
      "text": "Lab Assistant",
      "bbox": [
        431,
        519,
        535,
        542
      ],
      "confidence": 0.9998916983604431
    },
    {
      "text": "Portland, OR",
      "bbox": [
        71,
        542,
        168,
        561
      ],
      "confidence": 0.9616896510124207
    },
    {
      "text": "6/1990 - 8/1990",
      "bbox": [
        432,
        536,
        557,
        562
      ],
      "confidence": 0.971911609172821
    },
    {
      "text": "Honors:",
      "bbox": [
        69,
        591,
        133,
        612
      ],
      "confidence": 0.9984133839607239
    },
    {
      "text": "Scholarship Commendation, Reed College, 1987-88 and 1990-91.",
      "bbox": [
        70,
        620,
        551,
        644
      ],
      "confidence": 0.9919365048408508
    },
    {
      "text": "Commended for Excellence on Junior Qualifying Exam, Reed College, 1990.",
      "bbox": [
        70,
        651,
        628,
        679
      ],
      "confidence": 0.9900155663490295
    },
    {
      "text": "NSF Predoctoral Fellowship, 1993 - 1996.",
      "bbox": [
        71,
        688,
        372,
        710
      ],
      "confidence": 0.990268886089325
    },
    {
      "text": "Publications:",
      "bbox": [
        68,
        735,
        165,
        759
      ],
      "confidence": 0.9973418712615967
    },
    {
      "text": "None",
      "bbox": [
        66,
        765,
        117,
        795
      ],
      "confidence": 0.9998250007629395
    }
  ],
  "full_text": "BIOGRAPHICAL SKEtcH: REsEARcH AsSIstANt\nName:\nTheresa C. Swayne\nTitle:\nGraduate Research Assistant - NSF Predoctoral Fellow\n28 June, 1969 - San Francisco, California\nDate & Place of Birth:\nReed College, Portland, OR\nEducation:\nB.A. in Biology, 1991\nColumbia University, College of Physicians & Surgeons\nPh.D. (in progress)\nProfessional Experience:\nColumbia University, College of P & S\nGraduate Research Assistant\nNew York\n1993-present\nDepartment of Anatomy & Cell Biology\nOregon Health Sciences Center\nLab Assistant\nUniversity of Portland, Portland, OR\n4/1992-8/1992\nOregon National Resources Council\nIntern/Environmental Issues Writing\n6/1991 -4/1992\nPortiand, OR\nReed College\nLab Assistant\nPortland, OR\n6/1990 - 8/1990\nHonors:\nScholarship Commendation, Reed College, 1987-88 and 1990-91.\nCommended for Excellence on Junior Qualifying Exam, Reed College, 1990.\nNSF Predoctoral Fellowship, 1993 - 1996.\nPublications:\nNone"
}