{
  "page_id": 1,
  "metadata": {
    "file_name": "doc_0432.png",
    "image_width": 754,
    "image_height": 1000
  },
  "lines": [
    {
      "text": "Contract #16A",
      "bbox": [
        83,
        42,
        204,
        62
      ],
      "confidence": 0.991023063659668
    }
  ],
  "full_text": "Contract #16A"
}